id,answer
CORP-TAX-001,The question is asking about the Bemessungsgrundlage (BMG) for the Körperschaftsteuer (KSt). The answer is that the BMG for the KSt is the Bemessungsgrundlage (BMG) for the steuerpflichtigen Umsatz (SZU). The BMG for the SZU is the BMG for the Körperschaftsteuer (KSt).
CORP-TAX-002,"The question asks about the consequences of a corporation giving a loan to its shareholder without any interest. The answer is that there are no steuerlichen Konsequenzen, as the loan is not considered a debt and there is no interest charged. The loan is considered a non-taxable transfer of value, and the shareholder is not subject to any taxes on the loan."
CORP-TAX-003,"In the context of the Steuerpflichtigen, who are required to account for all income (Paragraph 2, Absatz 3, des Einkommensteuergesetzes 1988) to the extent that it is derived from their business activities (Paragraph 23, Ziffer eins, des Einkommensteuergesetzes 1988) under the Unternehmensrechtlichen Vorschriften. Relevant entities are rechnungslegungspflichtigen Erwerbs- und Wirtschaftsgenossenschaften and vergleichbaren unbeschränkten steuerpflichtigen ausländischen Körperschaften."
CORP-TAX-004,"In the context of the European Economic Area (EEA), dividends paid by an Austrian company to its Austrian subsidiary are taxed at a flat rate of 15%. The Austrian company's Austrian subsidiary is considered a separate tax entity for tax purposes, and the dividend is treated as a dividend paid to the Austrian company. The Austrian company's Austrian subsidiary is not considered a separate tax entity for tax purposes, and the dividend is treated as a dividend paid to the Austrian company. In the case of a dividend paid by an Austrian company to its Austrian holding company, the holding company is considered a separate tax entity for tax"
CORP-TAX-005,"The question asks about the difference between a ""open"" and a ""closed"" financial transaction under the Austrian Steuergesetz (Austrian Income Tax Act). A ""closed"" financial transaction is one where the financial transaction is closed to the public, while an ""open"" financial transaction is one where the financial transaction is open to the public. In the context of the question, ""open"" financial transactions refer to financial transactions where the financial transaction is open to the public, while ""closed"" financial transactions refer to financial transactions where the financial transaction is closed to the public."
CORP-TAX-006,"The question asks about the maximum possible loss abondance in a given year and whether there are any exceptions. The answer is that the maximum possible loss abondance in a given year is 3 million euros per year, and there are no exceptions."
CORP-TAX-007,"The question is asking about the concept of a ""mantelkauf"" in the context of Austrian tax law. A mantelkauf is a situation where a person acquires a widespread interest in a property, such as a share in a company, and the death of the original owner. In this case, the mantelkauf creates a new liability for the person who acquired the property, which is the person who acquired the property from the original owner. This liability arises upon the death of the original owner, and it is not subject to any further changes or modifications. The mantelkauf is a situation where the person acquires a widespread interest in a property, such as a"
CORP-TAX-008,"In the context of the German Steuerrecht, the question is short and precise on the subject of the subject. The answer is: Bei einem Forderungsverzicht auf Seiten des Gesellschafters ist der nicht mehr werthaltige Teil der Forderung steuerwirksam."
CORP-TAX-009,"In Jahren, in denen ein gemäß Ziffer 6, zugerechneter ausländischer Verlust mit einem ausländischen Gewinn verrechnet wird oder verrechnet werden könnte, ist ein Betrag in diesem Ausmaß beim beteiligten inländischen Gruppenmitglied bzw. Gruppenträger, dem der Verlust zugerechnet wurde, als Gewinn zuzurechnen. Scheidet das nicht unbeschränkt steuerpflichtige ausländische Gruppenmitglied aus der Unternehmensgruppe aus, ist im Jahr des Ausscheidens ein Betrag im Ausmaß aller zugerechneten im Ausland nicht verrech"
CORP-TAX-010,"The question is about the German version of the law on corporate income tax. The answer is no, as the question does not specifically mention the term ""steuerpflichtig"" (tax-binding) or ""Mitbeteiligte"" (Mitbeteiligungsgemeinschaft). The question only deals with the situation where a group of companies is financially bound to one another, and the term ""steuerpflichtig"" is not used. Therefore, the answer is no, as there is no explicit mention of the term ""steuerpflichtig"" in the question."
CORP-TAX-011,"Yes, Abschreibungen auf den niedrigeren Teilwert einer Beteiligung an einem Gruppenmitglied (Absatz 4) sind abzüglich von Beteiligungen an Gruppenmitgliedern nicht abzugsfähig. Im Falle der Anschaffung einer Beteiligung (Absatz 4) vor dem 1. März 2014 durch ein Gruppenmitglied bzw. den Gruppenträger oder eine für eine Gruppenbildung geeignete Körperschaft an einer betriebsführenden unbeschränkt steuerpflichtigen Beteiligungskörperschaft (Absatz"
CORP-TAX-012,"In the context of the Austrian Steuerrecht, the question is answered as follows: Ziffer 2 an anderen ausländischen Körperschaften, die die in der Anlage 2 zum Einkommensteuergesetz 1988 vorgesehenen Voraussetzungen des Artikels 2 der Richtlinie 2011/96/EU in der jeweils geltenden Fassung erfüllen, beteiligt sind. Die genannte Frist von einem Jahr gilt nicht für Anteile, die auf Grund einer Kapitalerhöhung erworben wurden, soweit sich das Beteiligungsaus"
CORP-TAX-013,"The question asks whether the provisions of KStG (Befreiung für Beteiligungserträge und internationale Schachtelbeteiligungen) and KStG (Abzugsverbot für Lizenzgebühren) can be applied simultaneously to the same corporation. The answer is yes, as both provisions can be applied to the same corporation, as they are both applicable to the same corporation in the context of the Umsatzsteuergesetz (UStG) 1994. This is because the provisions of KStG (Befreiung für Beteiligungserträge und internationale Schachtelbeteiligungen)"
CORP-TAX-014,"The question asks for the requirements for an international shareholder arrangement to be considered a ""shooting star"" under the German Income Tax Act (KStG). The requirements include: 1. Falling steuerpflichtige ausländische Körperschaften 2. Kapitalanteilen während eines ununterbrochenen Zeitraumes von mindestens einem Jahr mindestens zu einem Zehntel The requirements are based on the German Income Tax Act (KStG) and fall under the following sections: - Section 7 (2) - Section 7 (3) - Section 7 (4) - Section 7 (5) - Section"
CORP-TAX-015,"In the context of the German Steuerrecht (German Income Tax Law), (3) Absatz 3, the following applies: (3) Absatz 3, Bei der Ermittlung der Einkünfte bleiben Veräußerungsgewinne, Veräußerungsverluste und sonstige Wertänderungen aus internationalen Schachtelbeteiligungen im Sinne des Abs. 2 außer Ansatz. Dies gilt auch für den Untergang (Liquidation oder Insolvenz) der ausländischen Körperschaft, sofern nicht tatsächliche und endgültige Vermögensverluste"
CORP-TAX-016,"The answer is no. The Zinsen in connection with the Fremdfinancing of the acquisition of a non-tax-exempt investment for the purpose of acquiring a tax-exempt investment, as described in the KStG 1988, § 11, are not abutting with the exemption for the acquisition of a tax-exempt investment. They are subject to the tax rules for the acquisition of a tax-exempt investment. Therefore, they are not abutting with the exemption for the acquisition of a tax-exempt investment."
CORP-TAX-017,"In the context of the Österreichisches Steuerrecht (KStG) 1988, paragraph 12 (ab 1.1.2019) refers to paragraph 26c Z 73 of the KStG 1988 (ab 31.12.2025). This paragraph deals with the abatement of taxes on non-taxable income and expenses. The paragraph states that the abatement applies to the following categories of expenses: 1. Expenses incurred by the employer in the course of the employment relationship with the employee, 2. Expenses incurred by the employer in"
CORP-TAX-018,"No, freiwillige Spenden zu gemeinnützigen Zwecken (also ""giftspenden"") sind nicht abzugsfähig. Diese Spenden sind freiwillig, d.h. Sie sind nicht von einer Organisation oder einer Person ausdrücklich bestimmt. Sie sind freiwillig, weil sie von freiwilligen Personen gesammelt werden. Die freiwillige Spenden sind grundsätzlich abzugsfähig, da sie von freiwilligen Personen gesammelt werden. Die freiwilligen Spenden sind auch abzugsfähig, wenn sie von freiwilligen Personen gesammelt werden, da sie von freiwilligen"
CORP-TAX-019,"In the context of the European Securities and Markets Authority (EU) General Implementing Regulation (EStG) 1988/4a, the following questions are answered: 1. Which expenses are tax-exempt or tax-free in a GmbH, according to the EU-German law? (a) EU-governmental fines, (b) donations to beneficiaries, (c) audit fees, (d) licensing fees to affiliated companies with a 8% tax rate? 2. Which expenses are tax-exempt or tax-free in a GmbH, according to the EU-German"
CORP-TAX-020,The question is not answered in the given text.
CORP-TAX-021,The question asks about the method to determine the Gewinn when it is derived from the Einkommensteuergesetz (EStG) 1988. The answer is that it is derived from the Einkommensteuergesetz 1988 and is derived from the Einkommensteuergesetz 1988. The Gewinn is derived from the Einkommensteuergesetz 1988.
CORP-TAX-022,"The questions asked in the given text are: 1. Is the question about the following: a) The Zweigniederlassung zuzurechnen is, and b) Strichaufzählung is, and 2. Is the question about the following: a) Beteiligungsgemeinschaften (als Personengesellschaft, Beteiligungssyndikat oder im Wege gemeinsamer Kontrolle), wenn sie ausschließlich aus den in den Vorpunkten genannten Steuerpflichtigen gebildet werden, nach Maßgabe des Abs. 4. Als Beteiligungsgemeinschaft gelten jedenfalls Personen, die die"
CORP-TAX-023,"The question asks about the appropriate stewardship of a company's financial statements in the event of a loss year. The answer is that there are no specific stewardship requirements for a company in the event of a loss year. The financial statements are to be treated as they would be for any other year, and the company is free to use them in its financial reporting. The question does not specify any specific requirements for stewardship, and the answer is not limited to any particular scenario."
CORP-TAX-024,"The question asks about the Gewinnermittlungszeitraum, which is the time period during which the economic performance of a company is evaluated. It is defined as the economic period during which the company operates, including the period between the end of the fiscal year and the end of the financial year. The Gewinnermittlungszeitraum is a fundamental aspect of the accounting period, as it is the time period during which the economic performance of a company is evaluated. It is not a separate period, but rather a part of the accounting period. The Gewinnermittlungszeitraum is defined in the German Federal Financial Statement Act (EStG) 1988, §"
CORP-TAX-025,"In the context of the German Income Tax Act (KStG), paragraph 1, Absatz 1, of the Earnings Steering Act (EStG) states that the following are excluded from the Earnings Steering Act: 1. Absatz 1, Ziffer 14, Litera b, of the Einkommensteuergesetz (EStG) Paragraph 1, Absatz 1, of the EStG states that the following are excluded from the Earnings Steering Act: 1. Absatz 1, Ziffer 14, Litera b, of the Einkommensteuergesetz (ESt"
CORP-TAX-026,"Under the conditions set forth in Section 8 of the German Income Tax Act (Abgabenordnung), the loss abatement percentage for the 75th percentile of the income distribution is not limited to 75%."
CORP-TAX-027,The GrEStG 1987 § 1 and KStG 1988 § 9 require that the financial relationship between the shareholders of a company and the company itself must be established during the entire economic year of the shareholders' joint venture. The shareholders must meet the following conditions: 1. The shareholders must have a financial relationship with the company during the entire economic year of the joint venture. 2. The shareholders must have a financial relationship with the company during the entire economic year of the joint venture. 3. The shareholders must have a financial relationship with the company during the entire economic year of the joint venture
CORP-TAX-028,"The question asks about the length of the financial relationship between a group of companies and a single member. The answer is that the financial relationship must last throughout the entire economic year of the group, including the period during which the group is financially bound. This includes the period during which the group is financially unbound, but before the group is formed. The question does not specify the exact length of the financial relationship."
CORP-TAX-029,"No, Vorgruppenverluste des Gruppenträgers, die aus Teilwertabschreibungen auf Beteiligungen an Körperschaften einer anderen Unternehmensgruppe stammen, cannot be verrechanted with the Gruppengewinn. These losses are not included in the calculation of the Gruppengewinn."
CORP-TAX-030,"The answer is that if an Austrian corporation is unbeschränkt steuerpflichtig in Austria and Germany and wishes to be a Gruppenträger in both countries, it can only do so if it has a Zweigniederlassung in the Inland with a Beteiligung an Gruppenmitgliedern der Zweigniederlassung zuzurechnen. This means that it must have a separate legal entity in both countries, such as a GmbH or a société anonyme, to be a Gruppenträger. This is because Austria and Germany have different tax systems and different rules for Gruppenträger. In Austria, Gruppenträger is a legal term that refers to"
CORP-TAX-031,"Vortragsfähige Verluste (Paragraph 8, Absatz 4, Ziffer 2,) des unbeschränkt steuerpflichtigen Gruppenmitglieds aus Zeiträumen vor dem Wirksamwerden der Unternehmensgruppe (Vorgruppenverluste) oder aus einer umgründungsbedingten Übernahme durch ein Gruppenmitglied (Außergruppenverluste) können bis zur Höhe des eigenen Gewinnes des jeweiligen Gruppenmitglieds verrechnet werden. Vortragsfähige Verluste sind Verluste, die vor dem Wirksamwerden der Unter"
CORP-TAX-032,"In the context of the German Steuergesetz (KStG), the following questions are answered: 1. Which groups of individuals can be considered as ""experts"" for Austrian tax law? A. Examples: - Experts in Austrian tax law - Austrian tax lawyers - Austrian tax accountants 2. What is the difference between a ""self-employed"" and a ""non-self-employed"" group member in terms of the amount and timing of taxes to be paid? A. Self-employed group members pay taxes on their own income, while non-self-employed group members pay tax"
CORP-TAX-033,"No, the Einjahresfrist for international Schachtelbeteiligungen does not apply for Anteils aus Kapitalerhöhungen. The Einjahresfrist only applies for Anteilsauskünfte. Anteilsauskünfte entstehen durch Kapitalerhöhungen, die nach dem Einjahreszeitraum stattfinden."
CORP-TAX-034,"In the context of the German Steuerrecht, the following norms are relevant: 1. Absatz 3, Bei der Ermittlung der Einkünfte bleiben Veräußerungsgewinne, Veräußerungsverluste und sonstige Wertänderungen aus internationalen Schachtelbeteiligungen im Sinne des Abs. 2 außer Ansatz. Dies gilt auch für den Untergang (Liquidation oder Insolvenz) der ausländischen Körperschaft, sofern nicht tatsächliche und endgültige Vermögensverluste vorliegen. Diese Verluste sind um steuerfreie Gew"
CORP-TAX-035,"The question is asking if a 8% stake in a German GmbH is entitled to the international Schachtelbegünstigung. The answer is no, the dividend is still tax-free. The International Schachtelbegünstigung (ISGB) is a tax incentive that allows foreign investors to invest in German companies without being subject to German taxes. The ISGB applies to investments made by foreign investors in German companies that are not part of a group. The dividend received by the 8% stakeholder is not tax-free, as it is considered a non-taxable income. The dividend is taxed at the standard income tax rate of 19%"
CORP-TAX-036,"The option to pay Umgründungssteuer on a Schachtelbeteiligung in the case of international Schachtelbeteiligungen in the context of a Umgründung is only applicable to the acquirer (the company acquiring the Schachtelbeteiligung) and not to the seller (the company selling the Schachtelbeteiligung). The option is only binding on the acquirer, and the seller is not required to pay Umgründungssteuer on the Schachtelbeteiligung."
CORP-TAX-037,"The question is asking about the time when the gain from international portfolio bonds and qualified portfolio bonds (i.e., those with a minimum initial capital of €100,000) are considered to be steuerpflichtig (taxable) under the German Steuergesetz (German Income Tax Law). The answer is that these gain are considered to be steuerpflichtig from the inkrafttretensdatum (incorporation date) of the German Steuergesetz (German Income Tax Law) on January 1, 2020."
CORP-TAX-038,"Frage: Welche körperschaftsspezifischen Aufwendungen gelten nach § 11 KStG als Betriebsausgaben? Antwort: Die Absätze 4, 5 und 6 des Gesetzes über die Steuerung der Arbeitslosenversicherung (EStG) sind nicht auf die körperschaftsspezifischen Aufwendungen beschränkt. Die Betriebsausgaben sind: 1. Ziffer eins a) Litera a Beiträge des Versicherten zur Pflichtversicherung in der gesetzlichen Kranken-, Unfall- und Pensionsversicherung, Beiträge zur"
CORP-TAX-039,"In the context of the Umsatzsteuergesetz (USTG) 1994, the following exemptions are not considered as Betriebsausgaben: 1. Paragraph 6, Ziffer 5a: Zuwendungen an in Abs. 6 Z 2 und 12 genannten Einrichtungen sind nicht abzugsfähig, wenn sie durch eine Körperschaft im Sinne des § 1 Abs. 2 KStG 1988 erfolgen, die mit der Trägerkörperschaft dieser Einrichtung wirtschaftlich verbunden ist. 2. Paragraph 6, Ziffer 6: Zuwendungen"
CORP-TAX-040,"Frage: In welchen Wirtschaftsjahren ist ein Zinsüberhang in einem Konzernabschluss nach dem Unternehmensgesetzbuch, den International Financial Reporting Standards (IFRS) oder anderen vergleichbaren Rechnungslegungsstandards vollständig abzugsfähig, wenn das Verhältnis zwischen ihrem Eigenkapital und ihrer Bilanzsumme (Eigenkapitalquotenvergleich) am Abschlussstichtag dieses Wirtschaftsjahres gleich hoch oder höher ist als die Eigenkapitalquote des Konzerns (Eigenkapitalquotenvergleich)?"
CORP-TAX-041,"In the context of the German Steuergesetz (EStG), the answer is that the Gewinnermittlungszeitraum (GW) is the economic year (EJ) in which the economic activity of the Buchführende Land- und Forstwirte and rechnungslegungspflichtige Gewerbetreibende (BFLG) takes place. The GW is the economic year in which the economic activity of the Buchführende Land- und Forstwirte and rechnungslegungspflichtige Gewerbetreibende (BFLG) takes place. The GW is the economic year in which the economic activity of the Buchführende Land- und For"
CORP-TAX-042,"The question asks about the process of calculating the gross income of a corporation or a legal entity, and the specific abovementioned abuses that are addressed in the Einkommensteuergesetz (EStG) 1988. The EStG 1988 stipulates that the gross income of a corporation or legal entity is to be calculated by dividing the total assets by the total liabilities. The liabilities include the liabilities of the shareholders, the liabilities of the shareholders' companies, and the liabilities of the companies that are controlled by the shareholders. The abovementioned abuses are not addressed in the ESt"
CORP-TAX-043,"In the context of the Steuerpflichtigen, the underlyings of the question are the following: 1. Absatz eins, Für die Gewinnermittlung jener Steuerpflichtigen, die nach § 189 UGB oder anderen bundesgesetzlichen Vorschriften der Pflicht zur Rechnungslegung unterliegen und die Einkünfte aus Gewerbebetrieb (§ 23) beziehen, sind die unternehmensrechtlichen Grundsätze ordnungsmäßiger Buchführung maßgebend, außer zwingende steuerrechtliche Vorschriften treffen abweichende Regelungen. Die Widmung"
CORP-TAX-044,"No, the art of the question does not ask about the influence of the type of income distribution (e.g. Income from sale of goods, income from rental property, etc.) on the income measurement. The question only asks about the type of income distribution used to calculate the income."
CORP-TAX-045,"In the given text, the question is short and clear, asking for a simple and precise answer in German. The answer is ""Buchführende Land- und Forstwirte und rechnungslegungspflichtige Gewerbetreibende (Paragraph 5,) dürfen jedoch ein vom Kalenderjahr abweichendes Wirtschaftsjahr haben; in diesem Fall ist der Gewinn bei Ermittlung des Einkommens für jenes Kalenderjahr zu berücksichtigen, in dem das Wirtschaftsjahr endet."" The answer is ""Buchführende Land- und Forstwirte und rechnungslegungspflichtige Gewerbetreibende (Paragraph"
CORP-TAX-046,The questions and answers provided in the text are not specific to a particular topic or context. They are generic and do not provide a comprehensive answer to the given question. The text does not provide any information on the differences or similarities between a Mantelkauf (§ 8 KStG) and the Verlust von Verlustvorträgen bei Ausscheiden aus einer Gruppe (§ 9 KStG).
CORP-TAX-047,"The question asks whether a corporation can continue to use its losses after a Mantelkauf, and the answer is no. The question is referring to the German Corporate Insolvency Act (KStG), which states that a corporation cannot use its losses after a Mantelkauf. This is because the Mantelkauf is a legal process that allows a corporation to liquidate its assets and distribute its assets to creditors in exchange for a debt reduction. The question is asking about the legal consequences of a corporation's use of its losses after a Mantelkauf, which is not allowed under the KStG."
CORP-TAX-048,"The question is asking about the specific types of financial transactions that are considered as ""economic income"" under the Austrian Steuergesetz (Steuergesetz). The answer is that only those financial transactions that are explicitly mentioned in the statute (i.e., those that are explicitly mentioned in the first sentence of Article 1988) are considered as economic income. These include: 1. Reward payments to employees or members of the company, as long as they are not used to finance the company's activities. 2. Dividends paid to shareholders, as long as they are not used to finance the company's activities. 3. Zuw"
CORP-TAX-049,"In years, in which a foreign group member's accounting loss with an in-country loss is not yet fully recognized, a German-based group member or the group's German-based controller may be required to report the loss as a German-based group member's income. This is because the loss is not yet fully recognized in the foreign country, and the group's German-based controller is responsible for reporting the loss to the German tax authorities. The group's German-based controller must report the loss as a German-based group member's income, and the group's German-based income tax liability is calculated based on the foreign group member's accounting loss. The group's German-"
CORP-TAX-050,"The question asks about the benefits of the isolation of the group from the taxation system, specifically regarding the steuerliche Vorteile. The answer is that the isolation of the group from the taxation system provides a neutralization of the steuerlichen Abschreibungen and zuschreibungen, as well as the Gruppen-Zinsüberhang, in Litera a. This neutralization is necessary to calculate the Eigenkapitalquotenvergleich, which is essential for the Ermittlung der Eigenkapitalquote der Unternehmensgruppe. The neutralization is achieved by creating a consolidated group abschreibungs- and zuschreibungsvergleich, in which the unbeschränkten"
CORP-TAX-051,"In years, in which a group of companies with an inland group, profit-making subsidiary in the EU, and a non-EU subsidiary with Vortragsfähige Verluste, the following rules apply: 1. In the case of a group with an inland group, profit-making subsidiary in the EU, and a non-EU subsidiary with Vortragsfähige Verluste, the following rules apply: a. Vortragsfähige Verluste (Paragraph 8, Absatz 4, Ziffer 2,) des unbeschränkt steuerpflichtigen Gruppenmitglieds aus Zeit"
CORP-TAX-052,"The question is about the concept of a ""Gruppenträger"" in the context of Austrian tax law. According to the KStG 1988, § 9, a ""Gruppenträger"" is a legal entity that is financially bound to a group of individuals or a group of legal entities. The term ""Gruppenträger"" is used in the context of Austrian tax law to refer to a person or legal entity that is financially bound to a group of individuals or a group of legal entities. In the context of the question, the answer is ""Yes,"" as a ""Gruppenträger"" can be a legal entity that"
CORP-TAX-053,"No, there is no mention of a minimum or maximum bifurcation ratio or holdover period for inland Beteiligungsquoten in the given text."
