id,answer
VAT-DOM-007,"The question is asking about the location of the ""Beförderungsmittel"" (personal transportation) during the flight from Vienna to Madrid. The answer is that the ""Beförderungsmittel"" (personal transportation) is considered to be located in Spain, as the passenger who purchased the parfume on board the flight exits the plane in Madrid. Therefore, the ""Abgangsort"" (origin) of the parfume is considered to be in Spain."
VAT-DOM-008,"In Ermangelung eines solchen Sitzes oder einer solchen Betriebsstätte gelten sie an dem Ort genutzt oder verbraucht, wo der Abnehmer den Sitz seiner wirtschaftlichen Tätigkeit oder eine Betriebsstätte hat, an die die Gegenstände geliefert werden. In Ermangelung eines solchen Sitzes oder einer solchen Betriebsstätte gelten sie an dem Ort genutzt oder verbraucht, wo der Abnehmer die Gegenstände tatsächlich nutzt und verbraucht. Soweit die Gegenstände von diesem Abnehmer nicht tatsächlich verbraucht werden, gelten sie an dem Ort genutzt oder verbraucht,"
VAT-DOM-009,"The question is asking about the use of a demised property for the purpose of a company's business, which is a sonstige Leistung. The answer is no, as the use of the demised property for the purpose of a company's business is not considered a sonstige Leistung against entgelt. The use of the demised property for the purpose of a company's business is considered a sonstige Leistung against vollen Vorsteuerabzug, which is the same as the sonstige Leistung against entgelt."
VAT-DOM-010,"The UStG 1994 § 3 states that a Lieferung is made at the place where the goods are to be delivered to the buyer at the time of the delivery. In the case of a delivery to a place other than the buyer's place of business, the place of delivery is determined by the place where the goods are to be delivered at the time of the delivery. In the case of a delivery to a place other than the buyer's place of business, the place of delivery is determined by the place where the goods are to be delivered at the time of the delivery. In the case of a delivery to a place other than the buyer's place of business, the place of"
VAT-DOM-011,"The question is about the UStG 1994 § 3, which deals with the liability of the seller for the delivery of goods. (8) Absatz 8, Wird der Gegenstand der Lieferung durch den Lieferer oder den Abnehmer befördert oder versendet, so gilt die Lieferung dort als ausgeführt, wo die Beförderung oder Versendung an den Abnehmer oder in dessen Auftrag an einen Dritten beginnt. Versenden liegt vor, wenn der Gegenstand durch einen Frachtführer oder Verfrachter befördert oder eine solche Beförderung durch einen Spediteur besorgt"
VAT-DOM-012,"Based on the given text, the answer is no. The text states that the ""Werklieferung"" (work delivery) is not applicable in the case of a ""Lieferung"" (delivery) when the ""Bearbeitung oder die Verarbeitung eines vom Auftraggeber beigestellten Gegenstandes"" (manufacturing or processing of goods ordered by the buyer) is performed by the seller. Therefore, the text does not apply to the case of a ""Lieferung"" (delivery) when the ""Bearbeitung oder die Verarbeitung eines vom Auftraggeber beigestellten Gegenstandes"" (manufacturing or processing of goods ordered"
VAT-DOM-013,"The question is about the delivery of gas over an Erdgasnetz in the area of the Gemeinschaft or the joint network, and the supply of electrical energy to a paper factory in Linz, Austria. The question is about the liability of the German energy supplier for the delivery of electricity to the Austrian paper factory. The answer is that the Austrian paper factory is the recipient of the electricity, and the liability for the delivery of electricity rests with the German energy supplier. The question is not about the location of the delivery point, but about the recipient of the electricity."
VAT-DOM-014,The question is asking about a specific case where an Austrian Vermittler (an individual or company) is providing a service to a non-resident individual (a private person) in Italy for the purchase of a machine that is located in Belgium at the time of the transaction. The question is asking about the location of the Vermittlungsleistung (the service provided) in the case of a non-resident individual.
VAT-DOM-015,"The question is about the location of the performance site for the performance of a play. The answer is: [UStG 1994 § 3a] (6) Absatz 6, Eine sonstige Leistung, die an einen Unternehmer im Sinne des Abs. 5 Z 1 und 2 ausgeführt wird, wird vorbehaltlich der Abs. 8 bis 16 und Art. 3a an dem Ort ausgeführt, von dem aus der Empfänger sein Unternehmen betreibt. Wird die sonstige Leistung an die Betriebsstätte eines Unternehmers ausgeführt, ist stattdessen der Ort der Betriebs"
VAT-DOM-016,"Yes, in the context of the UStG 1994, the question is whether the seller, a Maschinenhändler, is required to transfer ownership of a CNC-Anlage to the buyer, a Kunde, after the full payment of the purchase price. The answer is no, as the seller is not required to transfer ownership until the full payment has been made. The buyer, in this case, is already entitled to use and sell the CNC-Anlage in his own name, without any further formalities. Therefore, the question is whether the seller has already transferred ownership to the buyer, even though the full payment has not yet been made. In this case,"
VAT-DOM-017,"The context of the question is related to the UStG 1994 § 3, which deals with the treatment of goods, by which the new product is created. The question asks about the treatment of goods, specifically the treatment of a new product, by which a new product is created. The answer is that the treatment of goods is a process of handling and processing, which can result in the creation of a new product. The question is asking about the treatment of goods, specifically the treatment of a new product, by which a new product is created."
VAT-DOM-018,"The question is asking about a specific situation where a U.S. Steel Corporation (U.S.C.) is providing a complex compliance analysis for an Austrian AG (A.G.) in Austria. The U.S.C. Is providing the analysis for the Italian AG's business operations in Austria, and the analysis is being performed in Austria. The analysis is being performed in Austria because the A.G. Has its seat in Austria. The question is asking whether the analysis is being performed at the A.G.'s location in Austria, which is the location of the A.G.'s business operations in Austria."
VAT-DOM-019,"The question is about the amount of compensation for a special entitlement for a worsened value of a jointly owned property that is not part of the agreement to avoid the sale. The answer is that it does not include a counter-claim for a worsened value. The question is about the amount of compensation for a special entitlement, not a counter-claim."
VAT-DOM-020,"The question is asking about the location of the sonic levy (i.e., the location where the sonic levy is to be paid) in the context of a dispute between two countries. In this context, the question is asking about the location of the sonic levy in the context of a dispute between two countries, specifically between Switzerland and Austria. The question is asking about the location of the sonic levy in the context of a dispute between two countries, specifically between Switzerland and Austria, and whether the location of the sonic levy is in the Inland (i.e., the location where the sonic levy is to be paid) or in the Drittlandsgebiet (i.e., the location"
VAT-DOM-021,"Yes, the viewpoint that the waterworks in the community's ownership is not covered by Section 1 of the UstG is correct. The community's argument is that the leasing of its waterworks to private businesses is not covered by Section 1 of the UstG, as it is not a ""general"" business. This is because the businesses leasing the waterworks are not subject to the general business tax (GStG) and are not considered to be ""undertakings"" under Section 1 of the UstG. Therefore, the leasing of the waterworks to private businesses is not subject to the UstG's provisions on the general business tax and undertakings"
VAT-DOM-022,"The answer is no. The question is about the interpretation of the UStG 1994 § 2, which states that the Wirkungen der Organschaft sind auf Innenleistungen zwischen den im Inland gelegenen Unternehmensteilen beschränkt. These companies are treated as companies to be treated as units of a single undertaking. The companies are considered to be units of a single undertaking, and the Wirkungen der Organschaft are limited to in-house leasing. The question is about the interpretation of the UStG 1994 § 2, which states that the Wirkungen der Organschaft sind auf Innenleistungen"
VAT-DOM-023,"Yes, according to the given text, the seller of custom-made special models is a person who regularly sells them to collectors. They calculate their income based on their ongoing production, but never earn any profit or surplus. They consider their ongoing production as a long-term investment, and their goal is to ensure the sustainability of their business. Therefore, the seller is a true entrepreneur and is not considered a consumer. The phrase ""nach § 2 UStG richtig"" means that the given text accurately reflects the legal requirements for entrepreneurs."
VAT-DOM-024,"No, the question does not ask about a steuerbarer Eigenverbrauch, but about the part of the restaurant's expenses that is not covered by the business's income. The question is asking about the part of the restaurant's expenses that is not covered by the business's income, which is the part that is not covered by the part of the expenses that is covered by the business's income. Therefore, the answer is no, the part of the restaurant's expenses that is not covered by the business's income cannot be considered a steuerbarer Eigenverbrauch."
VAT-DOM-025,"Yes, the underwriter is entitled to the 3.000 Euro in his billing basis, as the additional amount is wired to his account for the purpose of the contract. The 3.000 Euro is not included in the calculation of the total amount due, and it is not included in the calculation of the total amount due for the purpose of the contract. Therefore, the 3.000 Euro is not included in the calculation of the total amount due for the purpose of the contract."
VAT-DOM-026,"The question asks about the treatment of special patient groups for personalized treatments incurred by a physician in a service relationship with a hospital. The answer is that the special patient groups incurred by a physician in a service relationship with a hospital are not considered income under the Income Tax Act (UStG 1994) and are not taxed under the Einkommensteuergesetz 1988 (EStG). The physician is taxed on the income from the special patient groups, which are not considered income under the EStG. The special patient groups incurred by a physician in a service relationship with a hospital are not considered income under the UStG"
VAT-DOM-027,"Based on the given text, the question is about the interpretation of the UStG 1994 § 6 on the taxation of non-profit organizations. The question asks about the taxation of a non-profit organization that donates money to a community organization. The answer is that the question is about the interpretation of the UStG 1994 § 6, which states that the taxation of non-profit organizations is based on the taxation of land- and forestry businesses, gewerbliche Betriebe, or wirtschaftlichen Geschäftsbetriebes im Sinne des Paragraph 45, Absatz 3, der Bundesabgabenordnung. The"
VAT-DOM-028,"The question asks about the third payment made by a conglomerate to an agent for an entgeltliche Marketingleistung. The agent is obligated to invoice the third payment to the conglomerate, which is subject to the terms of the contract. The third payment is not included in the Bemessungsgrundlage, as it is not a payment for a specific entgeltliche Marketingleistung. Instead, it is a payment for services rendered by the agent to the conglomerate, which is subject to the terms of the contract."
VAT-DOM-029,"The Frage: (9) (9) Absatz 9, Ungeachtet Abs. 1 ist der Normalwert die Bemessungsgrundlage für Lieferungen und sonstige Leistungen durch den Unternehmer für Zwecke, die außerhalb des Unternehmens liegen oder für den Bedarf seines Personals, sofern Ungeachtet Absatz eins, ist der Normalwert die Bemessungsgrundlage für Lieferungen und sonstige Leistungen durch den Unternehmer für Zwecke, die außerhalb des Unternehmens liegen oder für den Bedarf seines Personals, sofern a) Litera a das Entgelt nied"
VAT-DOM-030,"(2) Absatz 2, Ist ein Gegenstand ausgeführt, in einem Drittlandsgebiet für den Ausführer veredelt und von dem Ausführer oder für ihn wieder eingeführt worden, so wird der Umsatz bei der Einfuhr nach dem für die Veredlung zu zahlenden Entgelt, falls aber ein solches Entgelt nicht gezahlt wird, nach der durch die Veredlung eingetretenen Wertsteigerung bemessen. Ist der eingeführte Gegenstand vor der Einfuhr geliefert worden und ist diese Lieferung nicht der Umsatzsteuer unterlegen, so gilt Abs. 1. [U"
VAT-DOM-031,"The Bemessungsgrundlage after Section 4 UStG is the amount that is equal to the normal value for the goods or services provided by the company or the business unit in question. In the case of a company or a business unit that is being sold, the normal value is the amount that is equal to the normal value for the goods or services provided by the company or the business unit in the course of the business. In the case of a company or a business unit that is being sold, the normal value is the amount that is equal to the normal value for the goods or services provided by the company or the business unit in the course of the business. In the case of a company or a business unit that is being sold"
VAT-DOM-032,"The question asks about a situation where a capital company provides a service to a shareholder at a price that is significantly lower than the market price. The shareholder is not required to pay the full VAT due. The company intends to claim the VAT on the actual amount paid by the shareholder. The question is about the Bemessungsgrundlage for the service provided. According to the given text, the Bemessungsgrundlage for the sonstige Leistung is the normal value, which is the lower of the market price and the actual amount paid by the shareholder."
VAT-DOM-033,"Paragraph 4 of the UstG 1994 (German: 1994 UStG) provides the following guidelines for the determination of the billing basis for the delivery, payment, and other expenses: 1. In the case of a delivery, payment, or expense, the billing basis is the amount that the seller or supplier is entitled to demand for the delivery, payment, or expense. 2. In the case of a delivery, the billing basis is the amount that the seller or supplier is entitled to demand for the delivery. 3. In the case of a payment, the billing basis is the amount that"
VAT-DOM-034,"In the text, the following questions are asked: 1. Ziffer 2: Die im Zeitpunkt der Entstehung der Steuerschuld auf den Gegenstand entfallenden Beträge an Zoll einschließlich der Abschöpfung, Verbrauchsteuern und Monopolabgaben sowie an anderen Abgaben mit gleicher Wirkung wie Zölle, wenn, diese Abgaben anläßlich oder im Zusammenhang mit der Einfuhr von Gegenständen vom Zollamt Österreich zu erheben sind. 2. Ziffer 3: Die auf den eingeführten Gegenstand entfallenden Nebenkosten wie Beförderungs-, Versicherungs-, Ver"
VAT-DOM-035,"The question asks about a natural person who is a member of the board of directors of an Aktiengesellschaft and receives compensation for their role in the company, including reimbursement for travel expenses. The natural person argues that the compensation is an underwriter's responsibility and is not a self-executing underwriter's function. Therefore, the compensation is not a self-executing function of the company and is instead a self-executing function of the underwriter. The question is whether this compensation is a self-executing function of the company, and the answer is no. The question is not about the legal status of the compensation, but about its nature and whether it is a self"
VAT-DOM-036,"The question asks about the distinction between a ""Bundesorgan"" and a ""Bundesunternehmen"" (German: Bundesbehörde or Bundesunternehmen) in terms of the taxation of the use of state-owned infrastructure by a private company. The answer is that the question is referring to a ""Bundesunternehmen"" (German: Bundesunternehmen) as defined in Section 2 of the German Unfair Competition Act (KStG). A ""Bundesunternehmen"" is a company that is established by the German government and is responsible for managing and operating state-owned assets. It is not a private company and is not subject to the same taxation rules as a"
VAT-DOM-037,"The question asks about a situation where an underwriter provides an insurance policy to a client. The underwriter is not required to pay for the insurance premium, but the client pays for the premium out of pocket. The client also pays for the additional insurance coverage, which is not required by the contract. The client's payment is not included in the billing or invoicing process, and the additional insurance coverage is not included in the billing or invoicing process. Therefore, the additional insurance coverage is not included in the billing or invoicing process, and the client's payment is not included in the billing or invoicing process. The additional insurance coverage is not included in"
VAT-DOM-038,"No, the question does not ask about whether the underwriter will accept a steuerbarter Umsatzsteuer on the insurance policy, but rather about whether the underwriter will accept a steuerbarter Eigenverbrauch on the insurance policy. The answer is no, as the question does not specify whether the insurance policy is subject to U.S. Income tax or not."
VAT-DOM-039,"Yes, according to the given text, the answer is yes. The UStG 1994 § 5 allows for the use of the Umsatzsteuer as a part of the Bemessungsgrundlage, even if it is a part of the cost of the imported goods. Therefore, the questioner's request to include the Umsatzsteuer in the Bemessungsgrundlage is allowed."
VAT-DOM-040,"The question asks about a natural person that provides services to its members only in the context of a non-business or non-professional activity. The answer is that the question is not specific enough to answer the question. The question does not specify whether the services provided are geared towards business or professional activities. Therefore, the answer is not applicable to the given scenario."
VAT-DOM-041,"Yes, the sale of an Austrian-made machine to an Austrian AG and delivery with the owner's own vehicle to the Swiss market is considered to be a non-taxable transfer of property under Article 3, Paragraph 4, of the UStG. This is because the buyer, the AG, is not an Austrian taxpayer and the seller, the machine manufacturer, is not an Austrian taxpayer either. Therefore, the sale is considered to be a non-taxable transfer of property under Article 3, Paragraph 4, of the UStG."
VAT-DOM-042,"The question is asking about a German GmbH that is closing its U.S. Branch and selling a product to an American customer. The question is asking whether the Zweigniederlassung (translation: ""foreign agent"" or ""foreign branch"") in the Swiss location is an iSd § 7. The answer is no, as the Zweigniederlassung is an iSd § 7. An iSd § 7 is a foreign branch that is located in Switzerland. The Zweigniederlassung in question is not an iSd § 7, as it is an ordinary Zweigniederlassung (translation: ""ordinary foreign agent"") that is located in the US."
VAT-DOM-043,"Yes, according to the provided text, the following questions can be answered: 1. Is the question about a specific case or a general question about the UStG 1994 § 7? Yes, the question is about a specific case. 2. Is the question about a specific provision or a general question about the UStG 1994 § 7? Yes, the question is about a specific provision. 3. Is the question about a specific provision or a general question about the GrEStG 1987 § 11? Yes, the question is about a specific provision. 4. Is the question about a specific"
VAT-DOM-044,"The question is about the Austrian Steuerrecht. According to the given text, the question is about the UStG 1994 § 3. The answer is no, according to the given text, the question is about the UStG 1994 § 7. The question is about the paragraph 7 of the given text, which deals with the export of goods. The paragraph 7 of the given text specifies the place of execution for the export of goods. It is stated that the goods must be located in the place where the buyer is located at the time of the export. The given text only mentions the place of execution for"
VAT-DOM-045,"Yes, the Unternehmer kann die Steuerfreiheit sofort beanspruchen, da er bereits bei der Lieferung des Ware im persönlichen Reisegepäck feststellt, dass der Ausfuhrnachweis erst nach acht Monaten vorliegt. In diesem Fall ist die Steuerfreiheit erst nach Vorliegen des Ausfuhrnachweises in Anspruch gestellt, so kann die zunächst vorgenommene Versteuerung des Ausfuhrumsatzes in der Voranmeldung für jenen Voranmeldungszeitraum rückgängig gemacht werden, in welchem der Ausfuhrnachweis beim Unternehmer einlangt,"
VAT-DOM-046,"No, the question does not ask about a Lohnveredlung (Paragraph 6, Abs. 1 Z 1) that occurs when the underwriter in Vienna receives from a Czech company parts that the latter previously purchased in this context in the Gemeinschaftsgebiet. The question is about a Lohnveredlung (Paragraph 6, Abs. 1 Z 1) that occurs when the underwriter in Vienna bears the costs of transporting and delivering the parts from Vienna to Serbia."
VAT-DOM-047,"Yes, under the conditions outlined in the text, the following questions are applicable: 1. Absatz eins The question refers to the following: ""Eine Lohnveredlung (§ 6 Abs. 1 Z 1) liegt vor, wenn der Unternehmer einen Gegenstand, den der Auftraggeber zu diesem Zweck in das Gemeinschaftsgebiet eingeführt oder zu diesem Zweck im Gemeinschaftsgebiet erworben hat, bearbeitet oder verarbeitet (§ 3 Abs. 6) oder eine sonstige Leistung im Sinne des § 3a Abs. 3 bewirkt und Eine Lohnveredlung ("
VAT-DOM-048,"The question is asking about the case where the Unternehmer, who is not a ""classic"" producer, exports a finished product to the Türkei, which falls under the section on ""Werklieferung"" in the UStG 1994. The answer is yes, as the Unternehmer is not ""klassisch"" (classical) in the sense of the section on ""Werklieferung"" and exports the finished product to the Türkei."
VAT-DOM-049,"The UStG 1994 § 8 states that the following conditions must be met for an Austrian company to be considered a ""solicitor"" for an ""outside contractor"" in the context of the UStG: (2) Absatz 2, Ein ausländischer Auftraggeber ist ein solcher, der die für den ausländischen Abnehmer geforderten Voraussetzungen (§ 7 Abs. 2) erfüllt. Ein ausländischer Auftraggeber ist ein solcher, der die für den ausländischen Abnehmer geforderten Voraussetzungen (Paragraph 7, Absatz 2,)"
VAT-DOM-050,"Yes, the Underwriter (the person who bears the risk of loss) can invoke the provisions of the UstG 1994 on behalf of the insurer (the person who is liable for the loss) in case of a loss caused by the insured (the person who is insured). The provisions of the UstG 1994 on the insurance contract and the liability of the insurer are applicable to the Underwriter. The Underwriter is not required to bear the risk of loss, but can invoke the provisions of the UstG 1994 on behalf of the insurer."
VAT-DOM-051,"Paragraph 9, (1) Absatz eins, Umsätze für die Seeschiffahrt (§ 6 Abs. 1 Z 2) sind: Umsätze für die Seeschiffahrt (Paragraph 6, Absatz eins, Ziffer 2,) sind: 1. Ziffer eins die Lieferungen, Umbauten, Instandsetzungen, Wartungen, Vercharterungen und Vermietungen von Wasserfahrzeugen für die Seeschiffahrt, die dem Erwerb durch die Seeschiffahrt oder der Rettung Schiffbrüchiger zu dienen bestimmt sind;"
VAT-DOM-052,"Yes, the fishing company can claim the exemption under Section 9 of the UStG 1994 on the basis of the following: 1. Ziffer 3 The deliveries of goods, which are for the purpose of the in Z 1 specified watercraft, are not be freed from the obligation to pay the VAT on the value of the goods. 2. Ziffer 4 And other than the goods specified in Z 1 and 2, other than their equipment and their supplies, the deliveries of goods, which are for the purpose of the in Z 1 specified watercraft, are not be freed from the obligation to pay the VAT on"
VAT-DOM-053,"Yes, the question asks if the Hafenserviceunternehmen (HSU) is befreit from the provision in UStG 1994 § 9 that requires the Lieferung of Bordproviant zur Versorgung von Wasserfahrzeugen der Küstenfischerei. The answer is no, as the HSU is required to provide the services of notifying the ship owner of a technical notewarning and stabilizing the ship's engine and cooling system during a technical failure. This is not a service that is covered by the provision in UStG 1994 § 9."
VAT-DOM-054,"The answer is no. The question does not specify whether the airline is flying exclusively on foreign or domestic routes, and the text does not mention any specific airline. Therefore, the question does not require an answer based on the given text."
