id,answer
VAT-INTL-010,"No, the question does not ask whether a non-performing act can exist without active participation by the underwriter. The question is about the specific types of sonstige Leistungen that can be executed without active participation by the underwriter."
VAT-INTL-011,"The UStG 1994 § 6 grants exemptions from the VAT on the following types of deliveries: 1. Ziffer 1: Lieferungen von Zahnersatz, bei denen sich der Ort der Lieferung gemäß Artikel 3, Absatz 3, aus dem Gebiet eines Mitgliedstaaten nach Österreich verlagert, wenn für die an den Unternehmer erbrachten Leistungen im anderen Mitgliedstaat das Recht auf Vorsteuerabzug nicht ausgeschlossen ist. 2. Ziffer 2: Lieferungen von menschlichen Organen, menschlichem Blut und Frauenmilch; 3. Ziffer 2: Beförder"
VAT-INTL-012,"The question is asking about the circumstances under which a non-existent or partial payment is considered an entgelt. The answer is that a tauschähnlicher Umsatz occurs when the payment for a sonstige Leistung in a Lieferung or in a sonstige Leistung exists. This is based on the text of the UStG 1994, § 3a."
VAT-INTL-013,"Sure, here's the rephrased question in German: Frage: ""Liegt ein tauschähnlicher Umsatz vor, wenn eine Leistung nicht in Geld vergütet wird?"""
VAT-INTL-014,"(1) Absatz eins, Der Umsatz wird im Falle des § 1 Abs. 1 Z 1 nach dem Entgelt bemessen. Entgelt ist alles, was der Empfänger einer Lieferung oder sonstigen Leistung aufzuwenden hat, um die Lieferung oder sonstige Leistung zu erhalten (Solleinnahme); dazu gehören insbesondere auch Gebühren für Rechtsgeschäfte und andere mit der Errichtung von Verträgen über Lieferungen oder sonstige Leistungen verbundene Kosten, die der Empfänger einer Lieferung oder sonstigen Leistung dem Unternehmer zu ersetzen hat. Der"
VAT-INTL-015,The question asks about the qualification of the cost-free meals provided by a photographer to a restaurant. The answer is that the cost-free meals provided by a photographer to a restaurant are not considered to be a benefit under the Austrian Income Tax Act (EStG). The cost-free meals are considered to be a laufend geführte Aufzeichnung (laundry-recorded accounting entry) and must be clearly and precisely quantified in order to qualify for the benefit. The cost-free meals are not considered to be a benefit under the Austrian Income Tax Act because they are not part of a laufend geführte Aufzeichnung. The
VAT-INTL-016,"The question asks about the evaluation of the ""Leistung"" (work performance) in the context of the UStG 1994 § 3a. According to the text, the ""Leistung"" refers to the performance of the undertaking (the company) in fulfilling the obligations under the contract. In the context of the UStG 1994 § 3a, the ""Leistung"" is defined as the performance of the obligations under the contract, including the performance of the obligation to deliver a specific product or service. The ""Leistung"" is not dependent on the specific product or service provided, but is determined by the"
VAT-INTL-017,"The question is asking about the UstG 1994 § 3a, which states that an abuse of right occurs when the price for a specific type of payment is different from the price for a similar payment. The answer is that the UstG 1994 § 3a applies to situations where the price for a specific type of payment is different from the price for a similar payment. In this case, the tauschähnlicher Umsatz occurs when the price for a specific type of payment is different from the price for a similar payment."
VAT-INTL-018,"Both (11) and (11a) of the UStG 1994 require the reporting of sales taxes on events and services provided by event managers to their customers. The specific details on the reporting requirements for these events and services are not specified in the text. The text only mentions that the event manager must report the sales taxes on the services provided to their customers. The text does not specify which specific services are subject to the reporting requirements. However, it is likely that the services provided by event managers to their customers, such as catering, are subject to the reporting requirements. Therefore, the specific services provided by event managers to their customers, such as c"
VAT-INTL-019,"In the given text, the question is: ""Ein Unternehmer beauftragt im eigenen Namen eine IT-Dienstleistung bei einem Dritten und stellt sie seinem Kunden weiter in Rechnung. Wie wird diese Leistung behandelt?"" The answer is: The invoiced amount for the IT-Dienstleistung is to be paid to the IT-Service provider. The IT-Service provider is responsible for the payment of the invoiced amount. The payment is to be made to the IT-Service provider. The IT-Service provider is responsible for the payment of the invoiced amount. The payment is to be made to the IT-Service provider."
VAT-INTL-020,"The following is a possible response to the question ""Ein Reisebüro bucht im Namen eines Kunden eine Hotelübernachtung bei einem Drittanbieter. Wie sind die Leistungen umsatzsteuerlich zu behandeln?"" Response: Inkrafttretensdatum 01.11.2018 Abkürzung UStG 1994 Index 32/04 Steuern vom Umsatz Text Vorsteuerabzug bei Reisekosten Paragraph 13 Paragraph 13, Paragraph 13, Paragraph 1"
VAT-INTL-021,"The question is asking about the location where the services or goods are being sold or provided for the UstG 1994 § 4. The answer is that the UstG 1994 § 4 does not have a specific location for the UstG 1994 § 4. The services or goods are being sold or provided for the UstG 1994 § 4 at the location where the streaming service provider is located. Therefore, the location for the UstG 1994 § 4 is not specified."
VAT-INTL-022,"The answer is: The stipulation in question does not specify the location of the steuerliche Leistungsort for these fees, which is not specified in the given text. Therefore, the question is not answered."
VAT-INTL-023,"No, the UStG 1994 does not mention the concept of ""electronic service"" in the context of ""speicherplatz"" in the context of cloud storage. The term ""speicherplatz"" is not used in the context of cloud storage, and the question does not refer to the concept of ""electronic service"" in the context of cloud storage."
VAT-INTL-024,"The question asks about an Austrian mobile telecommunications provider that provides telecommunications services to a private individual. The person has their official residence in Austria, but holds a work visa for the United States for a full year. The mobile phone is used exclusively in the United States during this time. The question is about determining the steuerliche Leistungsort (taxable location) for these telecommunications services. The answer depends on the specific circumstances of the case. In general, the location where the services are provided is the place where the customer is physically located, or where the services are being used. In this case, the person's official residence in Austria is the steuerliche Leistungsort, as they"
VAT-INTL-025,"The question asks about the location where the specialized equipment is being leased by an Austrian company to a private person in Brazil. The answer is that the equipment is being leased from the Austrian company to the private person in Brazil, and the location where the equipment is being leased is not specified."
VAT-INTL-026,"The question asks about the location of the ""place of performance"" (the place where the performance of the contract occurs) for the U.S. Tax authorities in a case where an Austrian lawyer is advising a Swiss-based client in an inheritance dispute. The answer is that the location of the ""place of performance"" for the U.S. Tax authorities is the place where the performance of the contract occurs, which is the Swiss location."
VAT-INTL-027,"The question asks about the legal status of an online legal service provided by an Austrian lawyer to a Japanese client with a Japanese address. The answer is that the service is not steuerbar because it is not provided in Austria and does not involve an Austrian company or resident. The service is provided to a foreign client with a foreign address, which is outside Austria. Therefore, the service is not subject to Austrian taxes."
VAT-INTL-028,"The question asks who is considered as the Nichtunternehmer in the sense of the provisions regarding the location of the sonstige Leistung. The answer is that a person or personhood, not in the applicative range of the first and second clauses, is considered as the Nichtunternehmer."
VAT-INTL-029,"(1) Absatz eins, Einkommensteuerpflichtig sind nur natürliche Personen. (1) Absatz eins, Einkommensteuerpflichtig sind nur natürliche Personen. (1) Absatz eins, Einkommensteuerpflichtig sind nur natürliche Personen. (1) Absatz eins, Einkommensteuerpflichtig sind nur natürliche Personen. (1) Absatz eins, Einkommensteuerpflichtig sind nur natürliche Personen. (1) Absatz eins,"
VAT-INTL-030,"The question asks about the location of the online marketing campaign created by a Wiener Marketingagentur for a private person with a Wohnsitz in Canada. The answer is that the location of the sonstige Leistung (sonstige Leistung, sonstigen Leistungsempfänger) is the place where the campaign was created, i.e., the place where the online marketing campaign was executed."
VAT-INTL-031,The question asks about the steuerpflichtigkeit (taxability) of the IT-Spezialist (IT specialist) from Graz who is performing structured data processing for the private Ahnenforschung of a customer from Australia. The answer is that the steuerpflichtigkeit (taxability) of the IT-Spezialist from Graz is not specified in the given text.
VAT-INTL-032,"Sure, here's the rephrased question in German: Frage: ""Ein Österreicher vermietet seinen PKW für zwei Wochen an einen Schweizer Touristen. Ist das eine Katalogleistung nach Umsatzsteuerrecht?"""
VAT-INTL-033,"The question is asking about the location of the performance site for a performance of a song by a Wiener Musiker to a fan in Australia. The answer is: The performance site for a performance of a song by a Wiener Musiker to a fan in Australia is the location where the performance was performed, which is the location where the performance was recorded or broadcast."
VAT-INTL-034,"The question is about the location of the gas supply for a private customer in Switzerland. The answer is: The location of the gas supply for a private customer in Switzerland is the location of the gas supply for the Wiener Energieversorger. The gas supply for the private customer is provided by the Wiener Energieversorger, which is located in Vienna, Austria."
VAT-INTL-035,"The Bundesminister für Finanzen is empowered to establish in a joint agreement with the Bundesministerin für Klimaschutz, Umwelt, Energie, Mobilität, Innovation und Technologie, the criteria for evaluating the impact of the measures taken to reduce greenhouse gas emissions. The purpose of this regulatory decision is to establish the criteria for evaluating the impact of the measures taken to reduce greenhouse gas emissions. The regulatory decision is subject to the approval of the Federal Ministry of Finance."
VAT-INTL-036,"In both directions, the Leistungsort nach § 3a Abs. 16 UStG can be shifted by a Verordnung."
VAT-INTL-037,"Sure, I'd be happy to provide a translation of the question in German. Frage: ""Ein Landwirt bringt Getreide zur Mühle und erhält sofort die gleiche Menge Mehl aus dem Bestand des Müllers gegen eine Mahlgebühr. Wie ist dieser Vorgang umsatzsteuerlich einzustufen?"" Antwort: ""Einfuhren sind nicht Umsätze im Sinne dieser Vorschrift."""
VAT-INTL-038,"The first two sentences of the question refer to the first two paragraphs of the KStG 1988 § 12, which state that the first two sentences of the first two paragraphs of the KStG 1988 § 26, Ziffer 4, apply to reimbursements for expenses related to the management of a company's affairs, such as administrative expenses, travel expenses, and entertainment expenses. The first two sentences of the first two paragraphs of the EStG 1988 § 3, which state that the first two sentences of the first two paragraphs of the EStG 1988 § 26,"
VAT-INTL-039,"Sure, here's the revised text with the correct answer: [UStG 1994 § 3a] (4) Absatz 4, Besorgt ein Unternehmer eine sonstige Leistung, so sind die für die besorgte Leistung geltenden Rechtsvorschriften auf die Besorgungsleistung entsprechend anzuwenden. Ort der sonstigen Leistung [UStG 1994 § 3a] (4) Absatz 4, Besorgt ein Unternehmer eine sonstige Leistung, so sind die für die besorgte Leist"
VAT-INTL-040,"Paragraph 1, Ingredients: - ABSCHNITT - Paragraph 1 - Paragraph 2 - Paragraph 3 - Paragraph 4 - Paragraph 5 - Paragraph 6 - Paragraph 7 - Paragraph 8 - Paragraph 9 - Paragraph 10 - Paragraph 11 - Paragraph 12 - Paragraph 13 - Paragraph 14 - Paragraph 15 - Paragraph 16 - Paragraph 17 - Paragraph 18 - Paragraph 19 - Paragraph 2"
VAT-INTL-041,"The question asks about the location where the performance-based compensation (PBC) for a software development project is assigned for the two-year period from the date of the contract. The answer is that the location where the performance-based compensation (PBC) for a software development project is assigned for the two-year period from the date of the contract is the location where the software development project was initiated, which is the location where the software development project was initiated."
VAT-INTL-042,"The question is asking about the type of work that is considered a ""sonsitge"" or ""situated"" performance. The answer is that it refers to a situation or circumstance that is created or created by the performer, rather than being a situation or circumstance that exists before or after the performance. In this case, the performer has created a situation where the audience is required to engage with the work, and the work is created by the performer. This situation is created through the performer's actions and intentions, rather than being a situation that exists before the performance. The performer's actions and intentions create the situation, and the audience is required to engage with the work in order"
VAT-INTL-043,"The question is asking about a specific case where a person has their own company, Angela, and they have hired a staff member, Stolz, to work for them. Stolz has agreed to stay overnight at the company's property for two nights, which is a ""sonstige Leistung"" (unspecified task) of Stolz's. The question is asking whether this is a ""sonstige Leistung"" or a ""sonstigen Leistungsnachweis"" (unspecified performance report). The answer is that it is a ""sonstige Leistung"" (unspecified task) because it is not specified what the task is or how it is to be performed."
VAT-INTL-044,"The question asks if Herr Müller, the owner of a bakery, is required to pay the full value of his company car, which has been subject to full-value tax exemption, for a private outing with his family. The answer is no, as Herr Müller is not required to pay any additional taxes on the value of his company car. This is because the company car is exempt from taxes under the full value tax exemption, which applies to all vehicles used for business purposes."
VAT-INTL-045,"The question is about a person's ownership of a motorcycle, which is a type of personal property. The question is about whether the person's motorcycle is subject to a tax on its value. The answer is no, as the motorcycle is not considered a personal property subject to taxation. The question is about a person's ownership of a motorcycle, not about the taxation of the motorcycle."
VAT-INTL-046,The question is asking about the location where the sonstige Leistung (sic) is being executed for tax purposes. The answer is that the IT-Firma in Salzburg is being executed in Salzburg.
VAT-INTL-047,"The question asks about the location of the bookkeeping company that performs the bookkeeping for the Filiale in Linz. The answer is that the bookkeeping is performed at the Graz headquarters of the company, not at the Linz location. Therefore, the location of the bookkeeping is at the Graz headquarters."
VAT-INTL-048,"The question is asking about the fraudulent use of the term ""sonstige Leistung"" in the UStG 1994, which refers to any type of service that is not explicitly mentioned in the statute. The question is asking about the location of the sonstige Leistung, which is to be determined based on the context and the specific services being provided. The question does not specify which location is relevant, but it is assumed to be Vienna or Graz."
VAT-INTL-049,"The question asks about the location of the sonic performance that was performed by the artist in Vienna. The answer is that it was performed in Vienna, Austria."
VAT-INTL-050,"The answer is: [UStG 1994 § 3a] (13) Absatz 13, Die folgenden sonstigen Leistungen werden an dem Ort ausgeführt, an dem der Leistungsempfänger seinen Wohnsitz, Sitz oder gewöhnlichen Aufenthalt hat, soweit diese Leistungen an einen Nichtunternehmer im Sinne des Absatz 5 Z 3 erbracht werden: Die folgenden sonstigen Leistungen werden an dem Ort ausgeführt, an dem der Leistungsempfänger seinen Wohnsitz, Sitz oder gewöhnlichen Aufenthalt hat, soweit diese Leistungen an einen N"
VAT-INTL-051,"The question asks if the Grundstücksmakler's (Grundstücksmakler) Grundstücksleistung (Grundstücksleistung) is a ""stipulated"" or ""stipulated"" (stipuliert) sonstige Leistung (sonstige Leistung) in accordance with the UStG 1994 § 3a. The answer is ""yes"", as the Grundstücksmakler's Grundstücksleistung is a sonstige Leistung in accordance with the UStG 1994 § 3a. This is because the Grundstücksmakler's"
VAT-INTL-052,"The question asks about a family booking a vacation at a camping resort. The answer is that the family's sonstige Leistung (sonstigen Leistung) in this case is a sonstige Leistung im Zusammenhang mit einem Grundstück, and the location of the performance is the location of the Grundstück."
VAT-INTL-053,"The question asks if a woman named Frau Meier allows an underwriter to use her firm's land for an event, and it is a sonstige Leistung (unspecified work) in relation to a land. The answer is yes, as the event is a ground lease, and the land is used for the event. The event is considered as an unspecified work, and the land is used for the event. The event is not considered as a performance of a specific task, but rather as a lease of a land for a specific purpose. The performance of the event is considered as a sonstige Leistung (unspecified work) in relation to the land."
VAT-INTL-054,"Frage: ""Welche Leistung gilt als sonstige Leistung, wenn sie an einen Nichtunternehmer erbracht wird: eine Führung in einem Museum oder der Verkauf eines Kunstwerks in einer Galerie?"" Antwort: Die Führung in einem Museum oder der Verkauf eines Kunstwerks in einer Galerie ist eine sonstige Leistung, da diese Leistungen an einen Nichtunternehmer im Sinne des Abs. 5, Ziffer 3, erbracht werden."
VAT-INTL-055,"The UStG 1994 § 18 provides that the following provisions apply to the support of the delivery of goods, whose transport is usually accompanied by transport, if the recipient is a non-taxpayer: (11) (1) Unterstützt ein Unternehmer, der nicht selbst Steuerschuldner ist, die Lieferung von Gegenständen, deren Beförderung oder Versendung im Inland endet, an einen Abnehmer gemäß Art. 3 Abs. 4 oder sonstige Leistungen im Inland an einen Nichtunternehmer durch die Nutzung einer elektronischen Schnittstelle, beispielsweise eines Marktplatz"
VAT-INTL-056,"Frage: ""Was ist die Behandlung von elektronischen Publikationen im Sinne der Anlage 1 Ziffer 33, sowie Teile davon, die nicht vollständig oder im Wesentlichen aus Video- oder Musikinhalten bestehen bzw. Werbezwecken dienen?"" Antwort: ""Reparaturdienstleistungen (einschließlich Ausbesserung und Änderung) betreffend Fahrräder, Schuhe, Lederwaren, Kleidung oder Haushaltswäsche."" Frage: ""Was ist die Behandlung von sonstigen Leistungen, die nicht sonstige Leistungen sind?"" Ant"
VAT-INTL-057,"The question asks about where a restaurant or catering lease is executed if the restaurant or catering company is active at multiple locations. The answer is that the restaurant or catering lease is executed at the location where the restaurant or catering company is active at the time of the lease. This is because the lease is for the entire restaurant or catering company, and the location where the company is active at the time of the lease is the location where the lease is executed."
VAT-INTL-058,"The question is short and clear, and the provided text only answers the question in a simple and straightforward manner. The answer is ""Yes,"" as the text states that the seller, who is a company in Berlin, is purchasing Eintrittskarten for his employees for a Messe in Munich. This purchase is considered to be executed in Munich, where the performance of the services is actually taking place."
VAT-INTL-059,"The question is about the taxation of a motorboat rental in Hamburg. The answer is that the rental of a motorboat for two weeks is taxed as an outright rental, not as a short-term rental or a short-term rental with a different purpose."
VAT-INTL-060,"The short answer is no. The question does not specify whether the motorboat is being mined for a specific period of time or if it is being rented for a specific period of time. Therefore, the answer is no, the motorboat is not being mined for a specific period of time or if it is being rented for a specific period of time."
VAT-INTL-061,"The question is asking about the tax treatment of a short-term car rental in Munich, Germany. The answer is that the short-term car rental is taxed as an ""outside"" transaction, which means it is not subject to the standard 12-month lease tax. The short-term car rental is considered to be executed at the Munich address, which is the location where the car is kept and used. The car rental is considered to be executed during the 25-day period, which is the maximum duration of the lease."
VAT-INTL-062,"The short answer is no, as the question does not specify the duration of the short-term rental. The question is asking about a specific case where a woman rented a car for 25 days in Munich. The answer is no, as the question does not specify the duration of the short-term rental."
VAT-INTL-063,"The following are the excerpts from the UStG 1994 on the definition of ""sonstige Leistungen"" and their respective exemptions: (13) (13) Absatz 13, Die folgenden sonstigen Leistungen werden an dem Ort ausgeführt, an dem der Leistungsempfänger seinen Wohnsitz, Sitz oder gewöhnlichen Aufenthalt hat, soweit diese Leistungen an einen Nichtunternehmer im Sinne des Absatz 5 Z 3 erbracht werden: Die folgenden sonstigen Leistungen werden an dem Ort ausgeführt, an dem der Leistungsempfänger seinen Wohnsitz,"
VAT-INTL-064,"Frage: ""Ein Software-Developer in Österreich entwickelt ein SaaS für ein Unternehmen aus Japan. Wo ist die Leistung steuerpflichtig?"" Antwort: Die Leistung des Software-Entwicklers in Österreich ist steuerpflichtig, da die Steuerpflicht für Softwareentwicklungen in Österreich liegt. Die Steuerpflicht ist die Steuerpflicht, die nach dem Steuergesetz des Bundes und der Länder in Österreich eingehalten wird."
VAT-INTL-065,"The U.S. Tax Code does not have a specific provision for determining the tax liability of tourists who book an Airbnb in Austria. The tax liability for such individuals depends on the specific terms and conditions of the Airbnb rental agreement, as well as the applicable Austrian tax laws. It is recommended to consult with a tax advisor or legal professional for more detailed information on the specific tax implications of Airbnb bookings in Austria."
VAT-INTL-066,"The question asks about the location of the photography services provided by a Swiss photographer for a Swiss couple who got married in Bern. The answer is that the photography services were provided in Bern, the location of the wedding."
VAT-INTL-067,"The question is about the location of the Leistungsempfänger (the party responsible for the performance) in the case of an Austrian company that leases a car to an Italian private person. The answer is that the location of the Leistungsempfänger (the party responsible for the performance) in the case of an Austrian company that leases a car to an Italian private person is the place where the car is physically located, i.e., the place where the car is kept or stored. This location is determined by the location of the car in question, which is the place where the car is physically located. The location of the Leistungsempfänger (the party responsible for the performance)"
VAT-INTL-068,"[UStG 1994 § 6] (10) Absatz 10, Die Umsatzsteuer gehört nicht zur Bemessungsgrundlage. [UStG 1994 § 6] (10) Absatz 10, Die Umsatzsteuer gehört nicht zur Bemessungsgrundlage. [UStG 1994 § 4] (10) Absatz 10, Die Umsatzsteuer gehört nicht zur Bemessungsgrundlage. [UStG 1994 § 6] Z"
VAT-INTL-069,"The answer is: [EStG 1988 § 1] (4) Absatz 4, Auf Antrag werden auch Staatsangehörige von Mitgliedstaaten der Europäischen Union oder eines Staates, auf den das Abkommen über den Europäischen Wirtschaftsraum anzuwenden ist, als unbeschränkt steuerpflichtig behandelt, die im Inland weder einen Wohnsitz noch ihren gewöhnlichen Aufenthalt haben, soweit sie inländische Einkünfte im Sinne des § 98 haben. Dies gilt nur, wenn ihre Einkünfte im Kalenderjahr mindestens zu 9"
VAT-INTL-070,"The question does not specify the location of the show in Italy, so the answer is not applicable."
