id,answer
EMP-012,"The question does not specify the type of uniforms or the specific value of the ""steuerpflichtige Einkommen"" for the Mitarbeiter. Therefore, the answer is not applicable to the given context."
EMP-013,"No, the question does not ask about the bankangestellter's earnings from his freetime work. The question is about the earnings from his non-self-employed work, which is not included in the question. The bankangestellter's earnings from his freetime work are not included in the question."
EMP-014,"The question asks about the lohnsteuerpflichtigness of the mechanic's monetary compensation for using his own tools for work in the company. The answer is yes, as the mechanic's monetary compensation for using his own tools for work in the company is lohnsteuerpflichtig. This means that the employer is required to pay the mechanic's lohnsteuerpflichtig earnings."
EMP-015,"The question is asking about the taxation of a company that purchases a ""Climate Ticket"" for its employees to allow them to work and travel both at work and on personal time. The answer is that the employee must report the Climate Ticket as a receipt for tax purposes. The Climate Ticket is a travel document that allows employees to travel and work at the same time, and it is not considered a taxable item. The employee must report the Climate Ticket as a receipt for tax purposes."
EMP-016,"The question is asking about the amount of ""Urlaubsersatzleistung"" (Urlaubsüberschussleistung) that is to be paid to the employee upon the employee's termination of employment. This is not an amount earned by the employee, but rather a payment made to compensate for the unused vacation days that the employee has accrued. The answer is that this payment is not an amount earned by the employee, but rather a payment made to compensate for the unused vacation days that the employee has accrued."
EMP-017,"The question asks about the 300-euro pauschale for an employee who works in an office and is paid for work done in the home office. The employee's employer pays the employee for the work done in the home office, but does not cover the cost of electricity and internet usage. The employee is required to keep track of the 300-euro pauschale and report it to their employer. The employee's employer is responsible for covering the cost of electricity and internet usage for the home office."
EMP-018,"No, the question does not ask about whether the former employee's pension from the pension insurance company (PVA) is considered an ""income"" under the Employment Tax Act (EStG). The question is about whether the former employee's pension from the PVA is considered an ""Arbeitseinkommen"" under the Employment Tax Act. The answer is no, as the former employee's pension is not considered an ""income"" under the EStG."
EMP-019,"No, the question does not ask about the IT-Techniker's private use of the high-end notebook. The question is about the use of sonstige Leistungen (sonstige Leistungen) in the context of the UStG 1994. The IT-Techniker's use of the high-end notebook is not a subject of the question. The question is about the use of sonstige Leistungen in the context of the UStG 1994. The IT-Techniker's use of the high-end notebook is not a subject of the question."
EMP-020,"Sure, here's the translated version of the question: Question: A cashier in a supermarket receives monthly 30 € as ""Mankogeld"", which is usually considered as part of the cashier's taxable income. She wonders if this fixed amount is included in her taxable income."
EMP-021,"The question does not specify whether the pension contributions are also included in the employee's gross salary (earnings) or not. The answer is no, pensionszusagen are not included in the employee's gross salary (earnings) and are instead considered as part of the employee's pension contributions. Lit. cc is used to refer to leistungsorientierte Zusagen, which are not subject to the 10% limit for the last year of the pension contract."
EMP-022,"No, the question does not ask about the validity of unemployment insurance payments from an unrelated country. The question is about the validity of the payments from a country that is not the self-employed individual's place of work. The question is about the validity of the payments from a country that is not the place of work for the self-employed individual."
EMP-023,"No, the UStG 1994 § 2 does not include the term ""Unternehmer"" to refer to an individual who is a self-employed person. The term ""Unternehmer"" refers to a person who is a self-employed person, which includes individuals who are self-employed in a business or profession. The term ""Unternehmer"" does not include individuals who are employed by a company or organization."
EMP-024,"The question does not specify which specific provision of the German Social Accident Insurance Law (EStG) is being discussed. The answer depends on the specific provision in question. In the case of the question, the provision that applies is the provision that states that the amount of the employer's contribution to the social accident insurance fund (ASVG) for the benefit of the employee or the employee's dependents is not included in the calculation of the employee's gross salary for the purpose of determining the amount of the employee's social insurance contribution. The answer is that the amount of the employer's contribution to the social accident insurance fund (ASVG) for"
EMP-025,"The question asks about the interpretation of the term ""work"" in the context of the Austrian Steuergesetz (Austrian Income Tax Act). The answer is that the term ""work"" in the context of the Austrian Steuergesetz refers to the provision of services, such as employment, in the form of wages, salaries, or other remuneration. This includes both paid and unpaid work, such as volunteering or working for non-profit organizations. The Austrian Steuergesetz 1988 (Austrian Income Tax Act 1988) provides that the amount of the Austrian work tax (Austrian Arbeitslo"
EMP-026,"The question is asking about the unbeschränkten steuerpflichtig (unrestricted tax-exempt) status of an employee who is a citizen of a member state of the European Union or a state that is a member of the European Economic Area (EEA) and who is employed in Austria. The employee's income is considered to be earned in Austria and is subject to Austrian income tax. The employee's pension income is also considered to be earned in Austria and is subject to Austrian income tax. Therefore, the employee's pension income is considered to be unbeschränkten steuerpflichtig (tax-exempt) and is not subject to Austrian income tax"
EMP-027,"In the case of an outsourcing company, the question is about the treatment of the pension fund. In the case of an outsourcing company, the pension fund is not considered a separate legal entity. Therefore, the pension fund is not considered a separate legal entity for tax purposes. The pension fund is considered part of the company's business operations, and the company's shareholders are considered the beneficiaries of the pension fund. The company's shareholders are responsible for the management and administration of the pension fund, and they are also the beneficiaries of the pension fund's assets. The company's shareholders"
EMP-028,"Yes, the question asks if the contributions from the pension fund to the pension account are tax-exempt. The answer is yes, as the contributions from the pension fund to the pension account are not tax-exempt."
EMP-029,"In the context of the KStG 1988, the answer is that the steuerpflichtige Teile des Einkommens von der Körperschaftsteuer befreit werden, wenn die Pensionszusagen 80% des letzten laufenden Aktivbezuges nicht übersteigen. This means that the steuerpflichtige parts of the pension fund's income from the Pensionskassengesetz are also befreed, if the pension fund's pension fund's pension fund's pension fund's pension fund's pension fund's pension fund's pension fund's pension fund's"
EMP-030,"The question is about the former employee's earnings from a privatstiftung, which is not explicitly mentioned in the given text. Therefore, the answer is no, these earnings are not taxable."
EMP-031,"The question is asking about the amount of a former business owner's one-time ""thank-you"" payment from the pension fund, without any contractual obligation. This payment is not counted as an employee's salary, and it is not considered as an employment benefit. Therefore, it does not fall under the definition of ""work-related benefits"" in the German Social Code (EStG)."
EMP-032,"In the context of the Pensionskassen im Sinne des Pensionskassengesetzes and ausländische Einrichtungen im Sinne of the Pensionskassengesetz, the question is answered as follows: Absatz eins, Pensionskassen im Sinne des Pensionskassengesetzes und ausländische Einrichtungen im Sinne des § 5 Z 4 des Pensionskassengesetzes sind hinsichtlich des einer Veranlagungs- oder Risikogemeinschaft zuzurechnenden Teiles des Einkommens von der Körperschaftsteuer befreit, wenn die Pensionszusagen 8"
EMP-033,"The Frage is answered as ""Yes"" as the monetary compensation paid to the widow of the deceased employee is considered as an employment benefit, which is considered as an ""Arbeitslohn"" under the EStG. This compensation is not considered as an ""Arbeitslohn"" for the purpose of calculating the amount of the pension."
EMP-034,"The EStG 1988 does not mention the term ""einkommensteuer"" and does not provide a specific definition. Therefore, the answer to the question is not specified. The given text only mentions the terms ""einkommensteuer"" and ""einkommensteuer unterliegen"" and does not provide any further information."
EMP-035,The question is asking about the Steuerpflichtigkeit (tax obligation) of an employee who receives a payout from the Insolvenz-Entgelt-Fonds (Insolvency Funds' Compensation Fund) after the employee's employer went bankrupt. The answer is that the employee's employer's payout is not considered taxable income.
EMP-036,"The question is asking about the tax-exempt status of a company's pension fund, which is a type of steuerpflichtig. The answer is no, as the pension fund is not tax-exempt and the “Treuebonus” is not considered a tax-exempt benefit. The pension fund is subject to the same taxes as any other employer, and the “Treuebonus” is not exempt from income tax."
EMP-037,"Yes, according to the given text, a person who receives a non-employer-provided work-related income supplement (ESS) that is not derived from a specific employer is considered to be an arbitrageur and is not subject to the 25% tax on the supplement. Therefore, the underlined portion of the question is not applicable and can be removed."
EMP-038,"Both the person's social security pension and additional support payments from a social security institution are both subject to the same rules and regulations regarding their allocation and distribution. Therefore, both the pension and the additional support payments are treated as equal and are not subject to any specific allocation or distribution rules."
EMP-039,"The question asks about the handling of the deceased employee's long-term employment benefits, such as the company's overdue payments. The answer is that the benefits must be handled according to the following guidelines: 1. The deceased employee's benefits must be overdue. 2. The company must have laundered the funds in a laudable manner, such as by keeping them in an account or investment vehicle. 3. The company must have a laudable record of financial management. 4. The company must have a laudable record of financial reporting. 5. The company must have a laudable record of financial controls. 6. The company must"
EMP-040,"Yes, both parts of the pension payment, i.e., the employee's own contributions and the employer's contributions, are considered to be taxable. The employee's contributions are taxed at the basic rate, while the employer's contributions are taxed at the higher rate. Therefore, both parts of the pension payment are subject to taxation."
EMP-041,"The question is about the value of the leased property as a source of income for the Mitarbeiter A. The answer is that the value of the leased property is calculated based on the original purchase price of the property, which in this case is 600,000€."
EMP-042,"Litera d (22. Ziffer 22) The Mitarbeiterrabatt is steuerfrei, as the 5 € Gutschein is a fixed amount that is not subject to any taxes or deductions. It is not subject to any taxes or deductions, and is not subject to any taxes or deductions. Therefore, it is not subject to any taxes or deductions."
EMP-043,"The question asks whether a shareholder with a 25% stake in a company can use an electric car for both private and professional use, and whether the car must be classified as a steuerpflichtiger Sachbezug for both private and professional use. The answer is no, as the shareholder's use of the car for private use is not considered to be a steuerpflichtiger Sachbezug. The car must be classified as a private use only."
EMP-044,"The question asks about the additional 50€ per month provided to the employee for using a car with gasoline. The answer is that the employee's additional income of 8,000€ per year is not considered in calculating the additional 50€ per month provided to the employee for using a car with gasoline. The additional 50€ per month provided to the employee is calculated based on the total income of the employee, including the additional income for using the car with gasoline."
EMP-045,"The question does not specify which employer is providing the workplace benefits, such as a salary increase, and the answer is no, the employer is not providing a steuerpflichtiger Arbeitslohn. The employer is providing a climate ticket, which is a voluntary contribution to a climate protection fund. The climate ticket is not a mandatory contribution to the employer's social security contributions. Therefore, there is no steuerpflichtiger Arbeitslohn."
EMP-046,"The question is about the treatment of Fahrtkostenvergütungen (FHV) for Fahrten zu einer Baustelle oder zu einem Einsatzort für Montage- oder Servicetätigkeit, die unmittelbar von der Wohnung angetreten werden. The answer is yes, the FHV for these Fahrten is treated as a Pendlerpauschale, which means that the full Pendlerpauschale is retained. Therefore, the question is not about the treatment of FHV, but about the retained Pendlerpauschale."
EMP-047,"The question asks if an employee who is an installer is considered a ""mandatory"" employee for the purpose of the ""sachbezug"" (sales tax) exemption under the Austrian Employment Law. The answer is no, as the employee is not considered a ""mandatory"" employee for the purpose of the exemption. The employee is considered a ""mandatory"" employee for the purpose of the ""sachbezug"" (sales tax) exemption only if the employee is performing work that is not covered by the exemption. In this case, the employee is performing work that is covered by the exemption, which is installing and transporting tools and materials from the workplace to the home."
EMP-048,"In the context of the text, the question asks about the tax liability of the employer A for the payment of 2.500 € to his employee B for the installation of a work vehicle at home. The answer is that the employer A is not liable for the payment of any taxes on the value of the work vehicle. The value of the work vehicle is limited to the value of the work vehicle installed at home, which is 2.500 €."
EMP-049,"The question is about a company that replaces its employee's expenses for the leasing of the company's E-business. The company has a company-owned E-business, and the employee is replacing the expenses for the leasing of the E-business to home. The employee's expenses are pauschal 50 € per month. The question is whether the employee's expenses are a steuerpflichtiger Sachbezug. The answer is no, as the employee's expenses are not a steuerpflichtiger Sachbezug. The employee's expenses are not related to the company's E-business, and the paus"
EMP-050,"The question asks if the employee who receives a company car with a firm-provided driver also receives a Pendlerpauschale for the days he uses his private E-Bike for transportation to and from work. The answer is no, as the employee is not entitled to a Pendlerpauschale for the days he uses his private E-Bike for transportation to and from work."
EMP-051,"The question asks about the employee's part-time status and whether they have an option to claim the Pendlerpauschale. The answer is yes, the employee has an option to claim the Pendlerpauschale. The employee is considered to be a part-time worker and is entitled to claim the Pendlerpauschale."
EMP-052,The question asks about the pensioner's eligibility for a full pensioner's pauschale on the basis of the workplace and the workplace location. The answer is that the pensioner can request a full pensioner's pauschale for the workplace and the workplace location. The question does not specify whether the pensioner is eligible for a partial pensioner's pauschale.
EMP-053,"Based on the given text, the following is a possible response to the question: Frage: In der Firma XY will der Chef seinen Mitarbeitern einen wöchentlichen Yogakurs mit einer zertifizierten Yogalehrerin im Büro organisieren. Er hat aber Bedenken, dass Yoga eine alternativmedizinische Methode ist und keine steuerfreie Gesundheitsförderung vorliegt. Was kann er machen? Antwort: 1. Steuerfrei sein: 1.1. Die Umsätze aus Heilbehandlungen im Bereich der Humanmedizin, die im Rahmen der Tätigkeit"
EMP-054,"No, the question does not ask whether the private use of the E-Bike is irrelevant for tax purposes. The question is about the amount of expenses that can be claimed for the private use of the E-Bike, which is not relevant for tax purposes. The answer is ""no"". The private use of the E-Bike is not considered relevant for tax purposes."
EMP-055,"The EStG 1988 § 3 provides that the gross benefit from the use of an elemental education institution, which includes workplace training, is a financial benefit from the employer or a group of employees. Litera c in this section refers to the financial benefit from the use of a workplace training institution. Litera c in this section also refers to the financial benefit from the use of an elemental education institution. Litera c in this section refers to the financial benefit from the use of a workplace training institution. Litera c in this section refers to the financial benefit from the use of an elemental education institution. Litera c in this section refers to the financial benefit from the use of a workplace"
EMP-056,"The question is about the employer's decision to pay for the membership of the local fitness studio to promote employee health. The answer is yes, the employer S is in the right to pay for the membership of the local fitness studio to promote employee health. This is a steuerfreie maßnahme (tax-free measure) as movement of the work-related health-promoting activity is included in the business's business activities."
EMP-057,"The question asks about a home office pauschale for a home-based employee, who is paid a fixed amount per day. The employee is paid 3 Euros per day for working from home. The employee's employer pays the pauschale to the employee, which is not subject to taxation. The employee can spend the pauschale on personal expenses, such as rent, utilities, and food, and it is not subject to any deductions or withholdings. The employee's employer can deduct the pauschale from their taxable income, but the amount cannot exceed the employee's actual expenses."
EMP-058,"The question is about the interpretation of the German Statutory Income Tax Act (EStG) regarding the eligibility for tax benefits. The question is short and clear, only based on the German Statutory Income Tax Act (EStG) textual sources. The question is about the interpretation of the German Statutory Income Tax Act (EStG) regarding the eligibility for tax benefits. The answer is that the question is about the interpretation of the German Statutory Income Tax Act (EStG) regarding the eligibility for tax benefits."
EMP-059,"Yes, the question asks whether the individual buyer, A, who owns 60% of the E-Auto, must include a privatized portion in his tax liability. The answer is yes, as E-Autos have a zero value for tax purposes."
EMP-060,"Sure, based on the given text, the question is about the exemption for private employer-provided EVs in the case of a cost-free on-demand service provided by the employer. The answer is no, the cost-free on-demand service provided by the employer is not subject to a cost-based exemption for EVs under the UStG 1994 (Gesetz über die Steuerung der Steuerpflicht durch die Einkommensteuerpflicht) and EStG 1988 (Gesetz über die Steuerung der Steuerpflicht durch das Arbeitsrecht)."
EStG-23-001,"No, the question does not ask about a private Vermögensverwaltung or a pre-existing business. The question is about a beleuchterte Briefmarkensammler, who sells his collection over a three-year period through an online platform, for the purpose of financing his living expenses. The question does not mention any private Vermögensverwaltung or a pre-existing business."
EStG-23-002,"No, the question does not ask about the sales of standardized hardware components by an IT-specialist. The question is about the sales of software-related services, such as software consulting and software licensing, which are not considered to be part of the hardware-related services. The answer is no, the sales of standardized hardware components are not considered to be part of the software-related services."
EStG-23-003,"The EStG 1988 does not specify whether the Einkommensteuer unterliegen nur ausschließlich aus dem Land- und Forstwirtschaftsbereich. However, the text of the law does not contradict this assumption. The text only mentions that the Einkommensteuer unterliegen nur aus dem Land- und Forstwirtschaftsbereich. Therefore, the Einkommensteuer unterliegen ausschließlich aus dem Land- und Forstwirtschaftsbereich, as the text does not contradict this assumption."
EStG-23-004,"The question asks about a company that operates a business that provides repair services for deficient electrical equipment for its close-knit circle of friends and family. The questioner is asking if this company is a rechnungslegungspflichtiger gewerbetreibender under the UGB. The answer is yes, as the company operates a business that provides repair services for deficient electrical equipment for its close-knit circle of friends and family. The company is a rechnungslegungspflichtiger gewerbetreibender under the UGB."
EStG-23-005,"Yes, the question is correct. The graphic artist works exclusively for a marketing agency. He uses the agency's office space and equipment, and is bound by fixed work hours. He follows the guidelines of the art director strictly. He wishes to declare his income as income from business under the section 23 of the EStG. This is correct."
EStG-23-006,"Based on the given text, it is not clear whether the transaction in question is a private or a commercial one. Therefore, it is not possible to determine whether the transaction is covered by the private or commercial provisions of the German Steuergesetz (GSTG)."
EStG-23-007,"Yes, the EStG states that gewerbliche Einkünfte (Abs. 3 Z 3) are defined as Einkünfte aus der Tätigkeit der offenen Gesellschaften, Kommanditgesellschaften und anderer Gesellschaften, bei denen die Gesellschafter als Mitunternehmer eines Gewerbebetriebes anzusehen sind. Therefore, the wine-producing business of a wine-bauer, where he mainly buys wine from his own vineyard and sells it to his guests, would be classified as gewerbliche Einkünfte."
EStG-23-008,"No, the question does not ask about the qualification of the income as Einkommensteuergesetz (EStG) under § 23. The question is about the qualification of the income as income from self-employment (§ 22) and income from self-employment under § 25. The income from self-employment is not qualified as Einkommensteuergesetz income, but as income from self-employment under the EStG."
EStG-23-009,"Yes, this IT-Enthusiast's use of specialized cryptocurrency mining equipment is considered a business activity under the German Steuergesetz (Fiscal Code) and is therefore subject to the provisions of the German Fiscal Code. The business activity is considered to be a business activity under the German Fiscal Code, and the business activity is not considered to be a business activity under the German Steuergesetz. Therefore, this business activity is not considered to be a business activity under the German Fiscal Code."
EStG-23-010,"Yes, this activity as a private wealth management or a self-employed business under the provisions of the German Income Tax Act (EStG) is also considered as a private Vermögensvermögen (private wealth management) or a private business under the provisions of the German Corporate Income Tax Act (EStG)."
EStG-23-011,"Yes, the losses from the sale of works in a small gallery are not considered to be steuerlich at the income from the sale of works in the gallery under the provisions of the German Income Tax Act (EStG). These losses are considered to be incurred in the course of the business of selling works of art, and are not subject to the special tax regime for business profits under the German Income Tax Act. Therefore, the losses from the sale of works in the gallery are not subject to German income tax."
